{
	"fixtureFamilyId": "amber.distributed-governance.fixture-family",
	"fixtureFamilyVersion": "1.0.0",
	"sourceBaseline": "docs/architecture/distributed-governance-baseline.md",
	"sourceRegistry": "docs/architecture/distributed-governance-contract-registry.json",
	"authorityBoundaries": {
		"repositoryLocalAuthority": true,
		"offlineCapability": true,
		"executesAnything": false,
		"appendOnlyLineage": true,
		"languageBoundary": "amber-internal"
	},
	"profiles": [
		{
			"id": "personal-node",
			"title": "Personal Node"
		},
		{
			"id": "team-hub",
			"title": "Team Hub"
		},
		{
			"id": "organization-profile",
			"title": "Organization Profile"
		}
	],
	"fixtures": [
		{
			"fixtureId": "DG-FIXTURE-PERSONAL-NODE-001",
			"kind": "canonical",
			"profile": "personal-node",
			"title": "Personal Node offline tracer",
			"inputs": {
				"repositoryScope": "local-repository",
				"localScope": {
					"tenant": "local-tenant-1",
					"organization": "local-organization-1",
					"person": "local-person-1"
				},
				"agentIdentities": [
					{
						"id": "local-agent-1",
						"admittedBy": "local-person-1"
					}
				],
				"repositoryRegistrations": [
					{
						"id": "local-repository-1",
						"tenant": "local-tenant-1",
						"organization": "local-organization-1"
					}
				],
				"decisions": [
					{
						"id": "decision-1",
						"title": "Admit local evidence",
						"provenance": [
							"evidence-1"
						]
					}
				],
				"evidence": [
					{
						"id": "evidence-1",
						"title": "Local evidence record",
						"source": "local-capture"
					}
				],
				"knowledgeCandidates": [
					{
						"id": "knowledge-candidate-1",
						"title": "Local knowledge candidate",
						"provenance": [
							"evidence-1"
						]
					}
				],
				"offlineOperation": {
					"mode": "offline-first",
					"required": true
				},
				"localProjections": [
					{
						"id": "local-governance-graph-1",
						"context": "governance-graph",
						"authority": "read-only",
						"rebuildable": true
					},
					{
						"id": "local-knowledge-base-1",
						"context": "governed-knowledge-base",
						"authority": "read-only",
						"rebuildable": true
					},
					{
						"id": "local-workbench-1",
						"context": "visualization-workbench",
						"authority": "read-only",
						"rebuildable": true
					}
				]
			}
		},
		{
			"fixtureId": "DG-FIXTURE-TEAM-HUB-001",
			"kind": "canonical",
			"profile": "team-hub",
			"title": "Team Hub synchronization tracer",
			"inputs": {
				"repositoryScope": "team-repository",
				"organizationControlPlane": {
					"tenant": "tenant-1",
					"organization": "organization-1",
					"personIdentities": [
						{
							"id": "person-1"
						},
						{
							"id": "person-2"
						}
					],
					"agentIdentities": [
						{
							"id": "agent-1",
							"admittedBy": "person-1"
						}
					],
					"team": {
						"id": "team-1",
						"structure": "flat-team"
					},
					"memberships": [
						{
							"personId": "person-1",
							"teamId": "team-1"
						},
						{
							"personId": "person-2",
							"teamId": "team-1"
						}
					],
					"repositoryRegistrations": [
						{
							"id": "repository-1",
							"tenant": "tenant-1",
							"organization": "organization-1"
						}
					],
					"roleAssignments": [
						{
							"id": "role-assignment-1",
							"personId": "person-1",
							"repositoryId": "repository-1",
							"role": "reader"
						}
					],
					"policyAssignments": [
						{
							"id": "policy-assignment-1",
							"policyId": "policy-1",
							"scope": "repository-1",
							"effect": "deny-wins"
						}
					]
				},
				"syncRuntime": {
					"syncSession": {
						"id": "sync-session-1",
						"mode": "bounded-delivery"
					},
					"envelopes": [
						{
							"id": "envelope-1",
							"kind": "sync-envelope",
							"sequence": 1
						}
					],
					"checkpoint": {
						"id": "checkpoint-1",
						"sequence": 1
					}
				},
				"sharedProjections": [
					{
						"id": "shared-governance-graph-1",
						"context": "governance-graph",
						"authority": "read-only",
						"rebuildable": true
					},
					{
						"id": "shared-workbench-1",
						"context": "visualization-workbench",
						"authority": "read-only",
						"rebuildable": true
					}
				]
			}
		},
		{
			"fixtureId": "DG-FIXTURE-ORGANIZATION-PROFILE-001",
			"kind": "canonical",
			"profile": "organization-profile",
			"title": "Organization Profile audit tracer",
			"inputs": {
				"repositoryScope": "organization-repositories",
				"organizationControlPlane": {
					"tenant": "tenant-1",
					"organization": "organization-1",
					"personIdentities": [
						{
							"id": "person-1"
						},
						{
							"id": "person-2"
						}
					],
					"agentIdentities": [
						{
							"id": "agent-1",
							"admittedBy": "person-1"
						}
					],
					"repositoryRegistrations": [
						{
							"id": "repository-1",
							"tenant": "tenant-1",
							"organization": "organization-1"
						},
						{
							"id": "repository-2",
							"tenant": "tenant-1",
							"organization": "organization-1"
						}
					],
					"roleAssignments": [
						{
							"id": "role-assignment-1",
							"personId": "person-1",
							"repositoryId": "repository-1",
							"role": "reader"
						}
					],
					"policyAssignments": [
						{
							"id": "policy-assignment-1",
							"policyId": "policy-1",
							"scope": "organization",
							"effect": "deny-wins"
						}
					],
					"administrativeFencing": {
						"transferRequired": true,
						"targetGenerationStartsWithNoAuthorization": true
					}
				},
				"boundedContextEvidence": [
					{
						"context": "amber-core",
						"evidence": [
							"decision-1",
							"evidence-1",
							"approval-1"
						]
					},
					{
						"context": "sync-runtime",
						"evidence": [
							"envelope-1",
							"checkpoint-1"
						]
					},
					{
						"context": "governance-graph",
						"evidence": [
							"projection-rule-1",
							"provenance-path-1"
						]
					},
					{
						"context": "governed-knowledge-base",
						"evidence": [
							"knowledge-record-1",
							"freshness-review-1"
						]
					},
					{
						"context": "visualization-workbench",
						"evidence": [
							"read-snapshot-1",
							"projection-receipt-1"
						]
					},
					{
						"context": "organization-control-plane",
						"evidence": [
							"identity-1",
							"policy-1"
						]
					}
				],
				"crossRepositoryGovernance": {
					"scope": "organization-wide",
					"queries": [
						{
							"id": "cross-repository-query-1",
							"repositories": [
								"repository-1",
								"repository-2"
							]
						}
					]
				}
			}
		}
	],
	"adversarialVariants": [
		{
			"variantId": "DG-FIXTURE-ADVERSARIAL-UNKNOWN-VERSION-001",
			"baseFixtureId": "DG-FIXTURE-TEAM-HUB-001",
			"category": "unknown-version",
			"expectedOutcome": "refused",
			"inputs": {
				"repositoryScope": "team-repository",
				"organizationControlPlane": {
					"tenant": "tenant-1",
					"organization": "organization-1",
					"personIdentities": [
						{
							"id": "person-1"
						},
						{
							"id": "person-2"
						}
					],
					"agentIdentities": [
						{
							"id": "agent-1",
							"admittedBy": "person-1"
						}
					],
					"team": {
						"id": "team-1",
						"structure": "flat-team"
					},
					"memberships": [
						{
							"personId": "person-1",
							"teamId": "team-1"
						},
						{
							"personId": "person-2",
							"teamId": "team-1"
						}
					],
					"repositoryRegistrations": [
						{
							"id": "repository-1",
							"tenant": "tenant-1",
							"organization": "organization-1"
						}
					],
					"roleAssignments": [
						{
							"id": "role-assignment-1",
							"personId": "person-1",
							"repositoryId": "repository-1",
							"role": "reader"
						}
					],
					"policyAssignments": [
						{
							"id": "policy-assignment-1",
							"policyId": "policy-1",
							"scope": "repository-1",
							"effect": "deny-wins"
						}
					]
				},
				"syncRuntime": {
					"syncSession": {
						"id": "sync-session-1",
						"mode": "bounded-delivery"
					},
					"envelopes": [
						{
							"id": "envelope-1",
							"kind": "sync-envelope",
							"sequence": 1
						}
					],
					"checkpoint": {
						"id": "checkpoint-1",
						"sequence": 1
					}
				},
				"sharedProjections": [
					{
						"id": "shared-governance-graph-1",
						"context": "governance-graph",
						"authority": "read-only",
						"rebuildable": true
					},
					{
						"id": "shared-workbench-1",
						"context": "visualization-workbench",
						"authority": "read-only",
						"rebuildable": true
					}
				],
				"adversarialVariant": {
					"category": "unknown-version",
					"expectedOutcome": "refused",
					"threatEvidence": {
						"negotiationAttempt": {
							"version": "unknown",
							"disposition": "fail-closed"
						}
					}
				}
			},
			"sequence": 1
		},
		{
			"variantId": "DG-FIXTURE-ADVERSARIAL-INCOMPATIBLE-VERSION-001",
			"baseFixtureId": "DG-FIXTURE-TEAM-HUB-001",
			"category": "incompatible-version",
			"expectedOutcome": "refused",
			"inputs": {
				"repositoryScope": "team-repository",
				"organizationControlPlane": {
					"tenant": "tenant-1",
					"organization": "organization-1",
					"personIdentities": [
						{
							"id": "person-1"
						},
						{
							"id": "person-2"
						}
					],
					"agentIdentities": [
						{
							"id": "agent-1",
							"admittedBy": "person-1"
						}
					],
					"team": {
						"id": "team-1",
						"structure": "flat-team"
					},
					"memberships": [
						{
							"personId": "person-1",
							"teamId": "team-1"
						},
						{
							"personId": "person-2",
							"teamId": "team-1"
						}
					],
					"repositoryRegistrations": [
						{
							"id": "repository-1",
							"tenant": "tenant-1",
							"organization": "organization-1"
						}
					],